{
  "entity_type": "universe",
  "version": "1.0",
  "sections": [
    {
      "id": "basic_information",
      "title": "Basic Information",
      "icon": "Globe",
      "columns": 2,
      "collapsed_default": false,
      "fields": [
        {
          "key": "id",
          "label": "Universe ID",
          "ui_component": "read-only-text",
          "auto_generate_from": "name",
          "help": "Auto-generated: lowercase, spaces replaced with underscores"
        },
        {
          "key": "name",
          "label": "Universe Name",
          "ui_component": "text",
          "required": true,
          "placeholder": "City of Brains"
        },
        {
          "key": "ip_owner",
          "label": "IP Owner",
          "ui_component": "text",
          "placeholder": "Biloxi Studios Inc."
        },
        {
          "key": "genre",
          "label": "Genre",
          "ui_component": "text",
          "placeholder": "horror_comedy"
        },
        {
          "key": "target_audience",
          "label": "Target Audience",
          "ui_component": "select",
          "options": [
            {"value": "kids", "label": "Kids"},
            {"value": "teen", "label": "Teen"},
            {"value": "teen_mature", "label": "Teen / Mature"},
            {"value": "mature", "label": "Mature"},
            {"value": "adult", "label": "Adult"}
          ]
        },
        {
          "key": "content_rating",
          "label": "Content Rating",
          "ui_component": "select",
          "options": [
            {"value": "E", "label": "E"},
            {"value": "E10+", "label": "E10+"},
            {"value": "T", "label": "T"},
            {"value": "M", "label": "M"},
            {"value": "AO", "label": "AO"}
          ]
        },
        {
          "key": "status",
          "label": "Status",
          "ui_component": "select",
          "options": [
            {"value": "development", "label": "Development"},
            {"value": "active", "label": "Active"},
            {"value": "archived", "label": "Archived"}
          ]
        },
        {
          "key": "version",
          "label": "Version",
          "ui_component": "text",
          "placeholder": "1.0"
        },
        {
          "key": "primary_image",
          "label": "Primary Image",
          "ui_component": "text",
          "column_span": 2
        }
      ],
      "editor_component": null,
      "viewer_component": null
    },
    {
      "id": "block_primary_image",
      "title": "Primary Image",
      "icon": "ImageIcon",
      "component": "primary-image",
      "component_config": {"object_fit": "contain"},
      "component_source": "builtin",
      "surface": "base",
      "collapsed_default": false,
      "editor_component": null,
      "viewer_component": null
    },
    {
      "id": "setting",
      "title": "Temporal & Geographic Setting",
      "icon": "Map",
      "columns": 2,
      "collapsed_default": false,
      "fields": [
        {
          "key": "era",
          "label": "Era",
          "ui_component": "text",
          "placeholder": "alternate_1990s"
        },
        {
          "key": "time_period",
          "label": "Time Period",
          "ui_component": "text",
          "placeholder": "1990-1999"
        },
        {
          "key": "technology_level",
          "label": "Technology Level",
          "ui_component": "text",
          "placeholder": "selective_advancement"
        },
        {
          "key": "world_type",
          "label": "World Type",
          "ui_component": "text",
          "placeholder": "earth_alternate"
        },
        {
          "key": "scope",
          "label": "Scope",
          "ui_component": "select",
          "options": [
            {"value": "local", "label": "Local"},
            {"value": "regional", "label": "Regional"},
            {"value": "global", "label": "Global"},
            {"value": "galactic", "label": "Galactic"}
          ]
        },
        {
          "key": "key_tech_rules",
          "label": "Key Tech Rules",
          "ui_component": "tag-input",
          "column_span": 2,
          "placeholder": "Add a technology rule..."
        }
      ],
      "surface": "secondary",
      "editor_component": null,
      "viewer_component": null
    },
    {
      "id": "themes_and_tone",
      "title": "Themes & Tone",
      "icon": "Heart",
      "columns": 1,
      "collapsed_default": false,
      "fields": [
        {
          "key": "primary_themes",
          "label": "Primary Themes",
          "ui_component": "tag-input",
          "placeholder": "Add primary theme..."
        },
        {
          "key": "secondary_themes",
          "label": "Secondary Themes",
          "ui_component": "tag-input",
          "placeholder": "Add secondary theme..."
        },
        {
          "key": "tone",
          "label": "Tone",
          "ui_component": "text",
          "placeholder": "dark_comedy_horror"
        }
      ],
      "editor_component": null,
      "viewer_component": null
    },
    {
      "id": "visual_style",
      "title": "Visual Style",
      "icon": "Palette",
      "columns": 1,
      "collapsed_default": false,
      "fields": [
        {
          "key": "art_style",
          "label": "Art Style",
          "ui_component": "text",
          "placeholder": "low_poly_luxe"
        },
        {
          "key": "lighting_style",
          "label": "Lighting Style",
          "ui_component": "text",
          "placeholder": "cinematic_dramatic"
        },
        {
          "key": "primary_colors",
          "label": "Primary Colors",
          "ui_component": "color-group",
          "swatches": [
            {"key": "synth_pink", "label": "Synth Pink"},
            {"key": "vapor_teal", "label": "Vapor Teal"},
            {"key": "moon_white", "label": "Moon White"},
            {"key": "static_purple", "label": "Static Purple"},
            {"key": "grime_grey", "label": "Grime Grey"}
          ]
        },
        {
          "key": "atmospheric_elements",
          "label": "Atmospheric Elements",
          "ui_component": "tag-input",
          "placeholder": "Add atmospheric element..."
        }
      ],
      "editor_component": null,
      "viewer_component": null
    },
    {
      "id": "audio_direction",
      "title": "Audio Direction",
      "icon": "Music",
      "columns": 2,
      "collapsed_default": true,
      "fields": [
        {
          "key": "music_genre",
          "label": "Music Genre",
          "ui_component": "text",
          "placeholder": "synthwave"
        },
        {
          "key": "sound_design",
          "label": "Sound Design",
          "ui_component": "text",
          "placeholder": "retro_futuristic"
        },
        {
          "key": "voice_direction",
          "label": "Voice Direction",
          "ui_component": "text",
          "column_span": 2,
          "placeholder": "naturalistic_90s"
        }
      ],
      "editor_component": null,
      "viewer_component": null
    },
    {
      "id": "narrative_rules",
      "title": "Narrative Rules",
      "icon": "BookOpen",
      "columns": 2,
      "collapsed_default": true,
      "fields": [
        {
          "key": "narrative_style",
          "label": "Narrative Style",
          "ui_component": "text",
          "placeholder": "environmental_storytelling"
        },
        {
          "key": "perspective",
          "label": "Perspective",
          "ui_component": "select",
          "options": [
            {"value": "first", "label": "First Person"},
            {"value": "second", "label": "Second Person"},
            {"value": "third", "label": "Third Person"},
            {"value": "mixed", "label": "Mixed"}
          ]
        },
        {
          "key": "storytelling_principles",
          "label": "Storytelling Principles",
          "ui_component": "tag-input",
          "column_span": 2,
          "placeholder": "Add principle..."
        }
      ]
    },
    {
      "id": "block_relationships",
      "title": "Cross-Entity References",
      "icon": "Network",
      "component": "entity-relationships",
      "component_config": {},
      "component_source": "builtin",
      "surface": "accent",
      "editor_component": null,
      "viewer_component": null
    },
    {
      "id": "markdown_body",
      "title": "Universe Overview & World Building",
      "icon": "FileText",
      "component": "markdown-content",
      "component_config": {},
      "component_source": "builtin"
    },
    {
      "id": "block_assets",
      "title": "Asset Browser",
      "icon": "Image",
      "component": "entity-assets",
      "component_config": {},
      "component_source": "builtin",
      "editor_component": null,
      "viewer_component": null
    }
  ],
  "updated_at": "2026-04-06T00:00:00.000Z",
  "created_at": "2026-04-06T00:00:00.000Z",
  "view_config": {
    "layout_driven": true
  }
}
